{
  "tool_version": "0.1.0",
  "files": [
    {
      "file": "s01.dat",
      "format": "UNKNOWN",
      "status": "unrecognized",
      "records": 0,
      "damage": 0
    },
    {
      "file": "s02.dat",
      "format": "UNKNOWN",
      "status": "unrecognized",
      "records": 0,
      "damage": 0
    },
    {
      "file": "s03.dat",
      "format": "UNKNOWN",
      "status": "unrecognized",
      "records": 0,
      "damage": 0
    },
    {
      "file": "s04.dat",
      "format": "UNKNOWN",
      "status": "unrecognized",
      "records": 0,
      "damage": 0
    },
    {
      "file": "s05.dat",
      "format": "UNKNOWN",
      "status": "unrecognized",
      "records": 0,
      "damage": 0
    },
    {
      "file": "s06.dat",
      "format": "UNKNOWN",
      "status": "unrecognized",
      "records": 0,
      "damage": 0
    },
    {
      "file": "s07.dat",
      "format": "UNKNOWN",
      "status": "unrecognized",
      "records": 0,
      "damage": 0
    },
    {
      "file": "s08.dat",
      "format": "UNKNOWN",
      "status": "unrecognized",
      "records": 0,
      "damage": 0
    },
    {
      "file": "s09.dat",
      "format": "UNKNOWN",
      "status": "unrecognized",
      "records": 0,
      "damage": 0
    },
    {
      "file": "s10.dat",
      "format": "UNKNOWN",
      "status": "unrecognized",
      "records": 0,
      "damage": 0
    },
    {
      "file": "s11.wks",
      "format": "UNKNOWN",
      "status": "unrecognized",
      "records": 0,
      "damage": 0
    },
    {
      "file": "s12.wks",
      "format": "UNKNOWN",
      "status": "unrecognized",
      "records": 0,
      "damage": 0
    },
    {
      "file": "s13.wks",
      "format": "UNKNOWN",
      "status": "unrecognized",
      "records": 0,
      "damage": 0
    },
    {
      "file": "s14.wpd",
      "format": "UNKNOWN",
      "status": "unrecognized",
      "records": 0,
      "damage": 0
    },
    {
      "file": "s15.wpd",
      "format": "UNKNOWN",
      "status": "unrecognized",
      "records": 0,
      "damage": 0
    },
    {
      "file": "s16.bravo",
      "format": "UNKNOWN",
      "status": "unrecognized",
      "records": 0,
      "damage": 0
    },
    {
      "file": "s17.bravo",
      "format": "UNKNOWN",
      "status": "unrecognized",
      "records": 0,
      "damage": 0
    },
    {
      "file": "s18.cvt",
      "format": "UNKNOWN",
      "status": "unrecognized",
      "records": 0,
      "damage": 0
    },
    {
      "file": "s19.cvt",
      "format": "UNKNOWN",
      "status": "unrecognized",
      "records": 0,
      "damage": 0
    },
    {
      "file": "s20.000",
      "format": "UNKNOWN",
      "status": "unrecognized",
      "records": 0,
      "damage": 0
    },
    {
      "file": "s21.000",
      "format": "UNKNOWN",
      "status": "unrecognized",
      "records": 0,
      "damage": 0
    },
    {
      "file": "s22.000",
      "format": "UNKNOWN",
      "status": "unrecognized",
      "records": 0,
      "damage": 0
    },
    {
      "file": "s23.wad",
      "format": "UNKNOWN",
      "status": "unrecognized",
      "records": 0,
      "damage": 0
    },
    {
      "file": "s24.pak",
      "format": "UNKNOWN",
      "status": "unrecognized",
      "records": 0,
      "damage": 0
    },
    {
      "file": "s25_random.bin",
      "format": "UNKNOWN",
      "status": "unrecognized",
      "records": 0,
      "damage": 0
    },
    {
      "file": "s26_empty.dat",
      "format": "UNKNOWN",
      "status": "unrecognized",
      "records": 0,
      "damage": 0
    },
    {
      "file": "s27_notes.txt",
      "format": "UNKNOWN",
      "status": "unrecognized",
      "records": 0,
      "damage": 0
    },
    {
      "file": "s28_tiny.dat",
      "format": "UNKNOWN",
      "status": "unrecognized",
      "records": 0,
      "damage": 0
    },
    {
      "file": "s29_almost_libra.dat",
      "format": "UNKNOWN",
      "status": "unrecognized",
      "records": 0,
      "damage": 0
    },
    {
      "file": "s30_png_like.dat",
      "format": "UNKNOWN",
      "status": "unrecognized",
      "records": 0,
      "damage": 0
    }
  ],
  "totals": {
    "ok": 0,
    "partial": 0,
    "unsupported": 0,
    "unrecognized": 30,
    "failed": 0
  },
  "diagnostics": {
    "summary": {
      "files": 30,
      "skipped": 1,
      "by_format": {
        "UNKNOWN": 30
      }
    },
    "files": [
      {
        "input": "s01.dat",
        "output": "s01.dat.json",
        "size": 289,
        "sha256": "218e4c2da04d66ba016baa5e67845eed185c73cbf5ac3ccad0b251e44e0fd09c",
        "status": "unrecognized",
        "format": "UNKNOWN",
        "variant": null,
        "confidence": 0.0,
        "probe_score": 0.0,
        "candidates": [
          {
            "format": "STUB",
            "score": 0.0
          }
        ],
        "attempts": [],
        "records_by_status": {
          "verified": 0,
          "consistent": 0,
          "unverified": 0,
          "lost": 0
        },
        "fields_by_status": {
          "verified": 0,
          "consistent": 0,
          "unverified": 0,
          "lost": 0
        },
        "members": 0,
        "damage": [],
        "coverage": {
          "bytes_total": 289,
          "bytes_explained": 0,
          "bytes_padding": 0,
          "explained_pct": 0.0,
          "accounted_pct": 0.0,
          "unexplained": [
            [
              0,
              289
            ]
          ],
          "unexplained_truncated": false
        },
        "bytes": {
          "size": 289,
          "sha256": "218e4c2da04d66ba016baa5e67845eed185c73cbf5ac3ccad0b251e44e0fd09c",
          "entropy": 5.8226,
          "entropy_sampled": false,
          "top_candidates": [
            {
              "format": "STUB",
              "score": 0.0
            }
          ]
        },
        "warnings": [],
        "errors": []
      },
      {
        "input": "s02.dat",
        "output": "s02.dat.json",
        "size": 424,
        "sha256": "594a9799d8998104e30425fa6a36cdc8436e2415739deffde29371cd08b7d3d4",
        "status": "unrecognized",
        "format": "UNKNOWN",
        "variant": null,
        "confidence": 0.0,
        "probe_score": 0.0,
        "candidates": [
          {
            "format": "STUB",
            "score": 0.0
          }
        ],
        "attempts": [],
        "records_by_status": {
          "verified": 0,
          "consistent": 0,
          "unverified": 0,
          "lost": 0
        },
        "fields_by_status": {
          "verified": 0,
          "consistent": 0,
          "unverified": 0,
          "lost": 0
        },
        "members": 0,
        "damage": [],
        "coverage": {
          "bytes_total": 424,
          "bytes_explained": 0,
          "bytes_padding": 0,
          "explained_pct": 0.0,
          "accounted_pct": 0.0,
          "unexplained": [
            [
              0,
              424
            ]
          ],
          "unexplained_truncated": false
        },
        "bytes": {
          "size": 424,
          "sha256": "594a9799d8998104e30425fa6a36cdc8436e2415739deffde29371cd08b7d3d4",
          "entropy": 5.8461,
          "entropy_sampled": false,
          "top_candidates": [
            {
              "format": "STUB",
              "score": 0.0
            }
          ]
        },
        "warnings": [],
        "errors": []
      },
      {
        "input": "s03.dat",
        "output": "s03.dat.json",
        "size": 311,
        "sha256": "55b4915b7b7f993aa2b6b2eaccc140cc84482ead62853bfa19f597405a5bd4d6",
        "status": "unrecognized",
        "format": "UNKNOWN",
        "variant": null,
        "confidence": 0.0,
        "probe_score": 0.0,
        "candidates": [
          {
            "format": "STUB",
            "score": 0.0
          }
        ],
        "attempts": [],
        "records_by_status": {
          "verified": 0,
          "consistent": 0,
          "unverified": 0,
          "lost": 0
        },
        "fields_by_status": {
          "verified": 0,
          "consistent": 0,
          "unverified": 0,
          "lost": 0
        },
        "members": 0,
        "damage": [],
        "coverage": {
          "bytes_total": 311,
          "bytes_explained": 0,
          "bytes_padding": 0,
          "explained_pct": 0.0,
          "accounted_pct": 0.0,
          "unexplained": [
            [
              0,
              311
            ]
          ],
          "unexplained_truncated": false
        },
        "bytes": {
          "size": 311,
          "sha256": "55b4915b7b7f993aa2b6b2eaccc140cc84482ead62853bfa19f597405a5bd4d6",
          "entropy": 5.7226,
          "entropy_sampled": false,
          "top_candidates": [
            {
              "format": "STUB",
              "score": 0.0
            }
          ]
        },
        "warnings": [],
        "errors": []
      },
      {
        "input": "s04.dat",
        "output": "s04.dat.json",
        "size": 259,
        "sha256": "b38f6e38270ff0698def2267d7fc87ce46ade8508039edcfa90356337741b6c3",
        "status": "unrecognized",
        "format": "UNKNOWN",
        "variant": null,
        "confidence": 0.0,
        "probe_score": 0.0,
        "candidates": [
          {
            "format": "STUB",
            "score": 0.0
          }
        ],
        "attempts": [],
        "records_by_status": {
          "verified": 0,
          "consistent": 0,
          "unverified": 0,
          "lost": 0
        },
        "fields_by_status": {
          "verified": 0,
          "consistent": 0,
          "unverified": 0,
          "lost": 0
        },
        "members": 0,
        "damage": [],
        "coverage": {
          "bytes_total": 259,
          "bytes_explained": 0,
          "bytes_padding": 0,
          "explained_pct": 0.0,
          "accounted_pct": 0.0,
          "unexplained": [
            [
              0,
              259
            ]
          ],